{
  "$schema": "https://json-schema.org/draft/2020-12/schema",
  "$id": "run_log.schema.json",
  "title": "run_log",
  "description": "Archivos de una corrida en .pyagent/runs/<run_id>/: log.json (cada llamada a la IA, tipo 'log') y results.json (métricas por función, tipo 'results').",
  "type": "object",
  "additionalProperties": false,
  "required": [
    "version",
    "tipo",
    "run_id",
    "fecha",
    "proyecto",
    "perfil",
    "modelos",
    "estado_final",
    "motivo_fallo",
    "es_simulado"
  ],
  "properties": {
    "version": { "const": "1" },
    "tipo": { "enum": ["log", "results"] },
    "run_id": {
      "type": "string",
      "pattern": "^[0-9]{8}-[0-9]{6}-[0-9a-f]{4}$",
      "description": "AAAAMMDD-HHMMSS-xxxx; es también el nombre de la carpeta de la corrida."
    },
    "fecha": { "type": "string", "minLength": 1, "description": "Inicio de la corrida, ISO 8601." },
    "proyecto": { "type": "string", "minLength": 1 },
    "perfil": { "type": "string", "minLength": 1 },
    "modelos": {
      "type": "object",
      "additionalProperties": false,
      "required": ["planner", "generator", "reviewer"],
      "properties": {
        "planner": { "$ref": "#/$defs/modelo" },
        "generator": { "$ref": "#/$defs/modelo" },
        "reviewer": { "$ref": "#/$defs/modelo" }
      }
    },
    "estado_final": { "enum": ["fin", "fallo_controlado"] },
    "motivo_fallo": { "type": ["string", "null"] },
    "es_simulado": { "type": "boolean", "description": "true si todas las llamadas usaron la IA simulada." },
    "rama": { "type": ["string", "null"], "description": "HU-21. Rama Git del proyecto al iniciar la corrida; null si no es un repositorio." },
    "llamadas": { "type": "array", "items": { "$ref": "#/$defs/llamada" } },
    "totales_por_agente": {
      "type": "object",
      "propertyNames": { "$ref": "#/$defs/agente" },
      "additionalProperties": { "$ref": "#/$defs/total_agente" }
    },
    "total_tokens": { "type": "integer", "minimum": 0 },
    "total_costo_usd": { "type": "number", "minimum": 0 },
    "objetivos": { "type": "array", "items": { "$ref": "#/$defs/objetivo" } },
    "resumen": { "$ref": "#/$defs/resumen" }
  },
  "allOf": [
    {
      "if": { "properties": { "tipo": { "const": "log" } } },
      "then": {
        "required": ["llamadas", "totales_por_agente", "total_tokens", "total_costo_usd"],
        "properties": { "objetivos": false, "resumen": false }
      }
    },
    {
      "if": { "properties": { "tipo": { "const": "results" } } },
      "then": {
        "required": ["objetivos", "resumen"],
        "properties": { "llamadas": false, "totales_por_agente": false, "total_tokens": false, "total_costo_usd": false }
      }
    }
  ],
  "$defs": {
    "agente": { "enum": ["planner", "generator", "reviewer"] },
    "tokens": {
      "type": "object",
      "additionalProperties": false,
      "required": ["prompt_tokens", "completion_tokens"],
      "properties": {
        "prompt_tokens": { "type": "integer", "minimum": 0 },
        "completion_tokens": { "type": "integer", "minimum": 0 }
      }
    },
    "modelo": {
      "type": "object",
      "additionalProperties": false,
      "required": ["proveedor", "modelo", "precio_entrada_usd_m", "precio_salida_usd_m"],
      "properties": {
        "proveedor": { "type": "string", "minLength": 1 },
        "modelo": { "type": "string", "minLength": 1 },
        "precio_entrada_usd_m": { "type": "number", "minimum": 0 },
        "precio_salida_usd_m": { "type": "number", "minimum": 0 }
      }
    },
    "llamada": {
      "type": "object",
      "additionalProperties": false,
      "required": [
        "agente",
        "funcion",
        "intento",
        "modelo",
        "prompt_tokens",
        "completion_tokens",
        "costo_usd",
        "es_simulado",
        "hora"
      ],
      "properties": {
        "agente": { "$ref": "#/$defs/agente" },
        "funcion": { "type": ["string", "null"], "description": "null en las llamadas del Planner (planifica el módulo completo)." },
        "intento": { "type": ["integer", "null"], "minimum": 1, "maximum": 3 },
        "modelo": { "type": "string", "minLength": 1 },
        "prompt_tokens": { "type": "integer", "minimum": 0 },
        "completion_tokens": { "type": "integer", "minimum": 0 },
        "costo_usd": { "type": "number", "minimum": 0 },
        "es_simulado": { "type": "boolean" },
        "hora": { "type": "string", "minLength": 1 }
      }
    },
    "total_agente": {
      "type": "object",
      "additionalProperties": false,
      "required": ["prompt_tokens", "completion_tokens", "costo_usd", "llamadas"],
      "properties": {
        "prompt_tokens": { "type": "integer", "minimum": 0 },
        "completion_tokens": { "type": "integer", "minimum": 0 },
        "costo_usd": { "type": "number", "minimum": 0 },
        "llamadas": { "type": "integer", "minimum": 0 }
      }
    },
    "objetivo": {
      "type": "object",
      "additionalProperties": false,
      "required": ["modulo", "funcion", "critical", "decision", "motivo_estancado", "metricas"],
      "allOf": [
        {
          "description": "Una prueba estancada siempre dice por qué se cortó; las demás no tienen motivo (HU-14).",
          "if": { "properties": { "decision": { "const": "stalled" } } },
          "then": { "properties": { "motivo_estancado": { "enum": ["limite_intentos", "error_repetido"] } } },
          "else": { "properties": { "motivo_estancado": { "const": null } } }
        }
      ],
      "properties": {
        "modulo": { "type": "string", "minLength": 1 },
        "funcion": { "type": "string", "minLength": 1 },
        "tipo": { "enum": ["funcion", "endpoint"], "description": "EN-16. Qué se probó; en un endpoint, funcion es \"MÉTODO /ruta\". Si falta, es una función." },
        "critical": { "type": "boolean" },
        "decision": {
          "enum": ["accept", "bug_detectado", "stalled", null],
          "description": "null si la corrida terminó en fallo controlado antes del veredicto."
        },
        "laundering_detectado": { "type": "boolean", "description": "HU-16/HU-18. Algún intento fue rechazado por debilitar las aserciones." },
        "duracion_s": { "type": "number", "minimum": 0, "description": "HU-18. Segundos desde el primer intento hasta el veredicto." },
        "controles": {
          "type": "object",
          "description": "HU-21. Checklist del último intento: true cumple, false no cumple, null sin dato o no aplica.",
          "additionalProperties": false,
          "required": ["sintaxis", "sandbox", "aserciones", "cobertura", "mutation"],
          "properties": {
            "sintaxis": { "type": ["boolean", "null"] },
            "sandbox": { "type": ["boolean", "null"] },
            "aserciones": { "type": ["boolean", "null"] },
            "cobertura": { "type": ["boolean", "null"] },
            "mutation": { "type": ["boolean", "null"] }
          }
        },
        "motivo_estancado": {
          "enum": ["limite_intentos", "error_repetido", null],
          "description": "Por qué se cortó una prueba stalled: limite_intentos (3 intentos) o error_repetido (mismo hash de error dos veces seguidas). El intento del corte es metricas.iteraciones."
        },
        "metricas": {
          "type": "object",
          "additionalProperties": false,
          "required": [
            "paso",
            "cobertura_lineas",
            "cobertura_ramas",
            "iteraciones",
            "tokens_por_agente",
            "mutation_score"
          ],
          "properties": {
            "paso": { "type": "boolean", "description": "Pass Rate de la función: el último test corrió sin error en el sandbox." },
            "cobertura_lineas": { "type": ["number", "null"], "minimum": 0, "maximum": 100 },
            "cobertura_ramas": { "type": ["number", "null"], "minimum": 0, "maximum": 100 },
            "iteraciones": { "type": "integer", "minimum": 0, "maximum": 3 },
            "tokens_por_agente": {
              "type": "object",
              "propertyNames": { "$ref": "#/$defs/agente" },
              "additionalProperties": { "$ref": "#/$defs/tokens" }
            },
            "mutation_score": {
              "type": ["number", "null"],
              "minimum": 0,
              "maximum": 100,
              "description": "Solo funciones critical: true; null hasta que EN-09 ejecute mutmut."
            }
          }
        }
      }
    },
    "resumen": {
      "type": "object",
      "additionalProperties": false,
      "required": [
        "total_funciones",
        "aceptadas",
        "bugs_detectados",
        "stalled",
        "sin_veredicto",
        "pass_rate",
        "cobertura_lineas_promedio",
        "costo_total_usd"
      ],
      "properties": {
        "total_funciones": { "type": "integer", "minimum": 0 },
        "aceptadas": { "type": "integer", "minimum": 0 },
        "bugs_detectados": { "type": "integer", "minimum": 0 },
        "stalled": { "type": "integer", "minimum": 0 },
        "sin_veredicto": { "type": "integer", "minimum": 0 },
        "pass_rate": { "type": "number", "minimum": 0, "maximum": 100, "description": "% de funciones cuyo último test pasó." },
        "cobertura_lineas_promedio": { "type": ["number", "null"], "minimum": 0, "maximum": 100 },
        "cobertura_ramas_promedio": { "type": ["number", "null"], "minimum": 0, "maximum": 100, "description": "HU-18. Opcional: las corridas anteriores no lo tienen." },
        "iteraciones_promedio": { "type": ["number", "null"], "minimum": 0, "maximum": 3, "description": "HU-18. Intentos promedio de las funciones con veredicto." },
        "costo_total_usd": { "type": "number", "minimum": 0 },
        "por_agente": {
          "type": "object",
          "description": "HU-18. Tokens y costo de cada agente en la corrida (igual que totales_por_agente de log.json).",
          "propertyNames": { "$ref": "#/$defs/agente" },
          "additionalProperties": { "$ref": "#/$defs/total_agente" }
        },
        "metas": {
          "type": "object",
          "description": "HU-18. Metas de la carta ([umbrales] de config.toml) y tope de gasto vigentes en la corrida.",
          "additionalProperties": false,
          "required": ["pass_rate_min", "cobertura_lineas_min", "iteraciones_promedio_max", "tope_por_corrida_usd"],
          "properties": {
            "pass_rate_min": { "type": "number", "minimum": 0, "maximum": 100 },
            "cobertura_lineas_min": { "type": "number", "minimum": 0, "maximum": 100 },
            "iteraciones_promedio_max": { "type": "number", "minimum": 0 },
            "tope_por_corrida_usd": { "type": "number", "minimum": 0 }
          }
        }
      }
    }
  }
}
